"No.","Time","Source","Destination","Protocol","Length","Info"
"1","0.000000000","1a:5e:19:76:52:13","Broadcast","ARP","60","Who has 172.27.0.2? Tell 172.27.29.25"
"2","0.005682535","172.27.26.33","172.217.18.138","TCP","66","42312  >  443 [ACK] Seq=1 Ack=1 Win=172 Len=0 TSval=2969281206 TSecr=1341834733"
"3","0.005683790","172.27.26.33","172.217.18.138","QUIC","1292","Initial, DCID=e52a07a0c85aec81"
"4","0.005701784","172.27.26.33","172.217.18.138","TCP","66","[TCP Dup ACK 2#1] 42312  >  443 [ACK] Seq=1 Ack=1 Win=172 Len=0 TSval=2969281206 TSecr=1341834733"
"5","0.005725081","172.27.26.33","172.217.18.138","QUIC","1292","Initial, DCID=e52a07a0c85aec81"
"6","0.011038467","172.27.26.33","172.217.18.138","TLSv1.2","687","Client Hello (SNI=searchnotifications-pa.googleapis.com)"
"7","0.011039954","172.27.26.33","142.250.201.138","TCP","74","38522  >  443 [SYN] Seq=0 Win=65535 Len=0 MSS=1460 SACK_PERM TSval=4043356165 TSecr=0 WS=512"
"8","0.011040022","172.27.26.33","142.250.201.138","TCP","74","38524  >  443 [SYN] Seq=0 Win=65535 Len=0 MSS=1460 SACK_PERM TSval=4043356180 TSecr=0 WS=512"
"9","0.011067790","172.27.26.33","172.217.18.138","TCP","687","[TCP Retransmission] 42312  >  443 [PSH, ACK] Seq=1 Ack=1 Win=172 Len=621 TSval=2969281209 TSecr=1341834733"
"10","0.011098069","172.27.26.33","142.250.201.138","TCP","74","[TCP Retransmission] 38522  >  443 [SYN] Seq=0 Win=65535 Len=0 MSS=1460 SACK_PERM TSval=4043356165 TSecr=0 WS=512"
"11","0.011104122","172.27.26.33","142.250.201.138","TCP","74","[TCP Retransmission] 38524  >  443 [SYN] Seq=0 Win=65535 Len=0 MSS=1460 SACK_PERM TSval=4043356180 TSecr=0 WS=512"
"12","0.013143096","vivoMobileCo_64:ca:86","Broadcast","ARP","60","Who has 172.27.0.2? Tell 172.27.28.110"
"13","0.062903478","fe80::e482:c5e9:dadb:aa00","ff02::1:3","LLMNR","84","Standard query 0x97eb A wpad"
"14","0.062903718","fe80::e482:c5e9:dadb:aa00","ff02::1:3","LLMNR","84","Standard query 0xb1df AAAA wpad"
"15","0.089667789","LiteonTechno_9c:e3:18","Broadcast","ARP","60","Who has 172.27.217.19? Tell 172.27.157.252"
"16","0.164895409","172.27.26.33","192.178.24.234","QUIC","1292","Initial, DCID=5d0f0c24ddc8ba1c, PKN: 3, CRYPTO, PADDING, CRYPTO, PING, PING, CRYPTO, PADDING, PING, PADDING, PING"
"17","0.164895602","172.27.26.33","172.217.18.138","QUIC","81","Handshake, DCID=e52a07a0c85aec81"
"18","0.164896941","172.27.26.33","172.217.18.138","QUIC","82","Handshake, DCID=e52a07a0c85aec81"
"19","0.164896986","172.27.26.33","142.250.201.138","TCP","66","38522  >  443 [ACK] Seq=1 Ack=1 Win=88064 Len=0 TSval=4043356270 TSecr=3688141255"
"20","0.164897032","172.27.26.33","142.250.201.138","TCP","66","38524  >  443 [ACK] Seq=1 Ack=1 Win=88064 Len=0 TSval=4043356272 TSecr=3987127945"
"21","0.164917415","172.27.26.33","192.178.24.234","QUIC","1292","Initial, DCID=5d0f0c24ddc8ba1c, PKN: 3, CRYPTO, PADDING, CRYPTO, PING, PING, CRYPTO, PADDING, PING, PADDING, PING"
"22","0.164938078","172.27.26.33","172.217.18.138","QUIC","81","Handshake, DCID=e52a07a0c85aec81"
"23","0.164942468","172.27.26.33","172.217.18.138","QUIC","82","Handshake, DCID=e52a07a0c85aec81"
"24","0.164945721","172.27.26.33","142.250.201.138","TCP","66","[TCP Dup ACK 19#1] 38522  >  443 [ACK] Seq=1 Ack=1 Win=88064 Len=0 TSval=4043356270 TSecr=3688141255"
"25","0.164949437","172.27.26.33","142.250.201.138","TCP","66","[TCP Dup ACK 20#1] 38524  >  443 [ACK] Seq=1 Ack=1 Win=88064 Len=0 TSval=4043356272 TSecr=3987127945"
"26","0.170801740","Intel_ee:8b:58","Broadcast","ARP","60","Who has 172.27.29.127? Tell 172.27.28.115"
"27","0.171711493","172.27.26.33","142.250.201.138","TLSv1.2","641","Client Hello (SNI=youtubei.googleapis.com)"
"28","0.171712616","172.27.26.33","172.217.18.138","QUIC","79","Handshake, DCID=e52a07a0c85aec81"
"29","0.171741075","172.27.26.33","142.250.201.138","TCP","641","[TCP Retransmission] 38522  >  443 [PSH, ACK] Seq=1 Ack=1 Win=88064 Len=575 TSval=4043356307 TSecr=3688141255"
"30","0.171773914","172.27.26.33","172.217.18.138","QUIC","79","Handshake, DCID=e52a07a0c85aec81"
"31","0.182569871","LiteonTechno_9c:e3:0d","Broadcast","ARP","60","Who has 172.27.6.197? Tell 172.27.155.38"
"32","0.214579202","Intel_57:a2:3d","Broadcast","ARP","42","Who has 172.27.29.2? (ARP Probe)"
"33","0.378418557","172.27.26.33","142.250.201.138","TLSv1.2","673","Client Hello (SNI=youtubei.googleapis.com)"
"34","0.378418760","172.27.26.33","172.217.18.138","QUIC","125","Handshake, DCID=e52a07a0c85aec81"
"35","0.378418805","172.27.26.33","172.217.18.138","QUIC","116","Protected Payload (KP0)"
"36","0.378418851","172.27.26.33","172.217.18.138","QUIC","74","Protected Payload (KP0)"
"37","0.378418896","172.27.26.33","172.217.18.138","QUIC","1288","Protected Payload (KP0)"
"38","0.378418939","172.27.26.33","172.217.18.138","QUIC","1292","Protected Payload (KP0)"
"39","0.378418985","172.27.26.33","172.217.18.138","QUIC","1292","Protected Payload (KP0)"
"40","0.378419030","172.27.26.33","172.217.18.138","QUIC","792","Protected Payload (KP0)"
"41","0.378451328","172.27.5.225","172.27.26.33","ICMP","590","Redirect             (Redirect for host)"
"42","0.378472318","172.27.26.33","142.250.201.138","TCP","673","[TCP Retransmission] 38524  >  443 [PSH, ACK] Seq=1 Ack=1 Win=88064 Len=607 TSval=4043356329 TSecr=3987127945"
"43","0.378477811","172.27.26.33","172.217.18.138","QUIC","125","Handshake, DCID=e52a07a0c85aec81"
"44","0.378481736","172.27.26.33","172.217.18.138","QUIC","116","Protected Payload (KP0)"
"45","0.378484928","172.27.26.33","172.217.18.138","QUIC","74","Protected Payload (KP0)"
"46","0.378488156","172.27.26.33","172.217.18.138","QUIC","1288","Protected Payload (KP0)"
"47","0.378492519","172.27.26.33","172.217.18.138","QUIC","1292","Protected Payload (KP0)"
"48","0.378496556","172.27.26.33","172.217.18.138","QUIC","1292","Protected Payload (KP0)"
"49","0.378500099","172.27.26.33","172.217.18.138","QUIC","792","Protected Payload (KP0)"
"50","0.378513527","172.27.26.33","172.217.18.138","QUIC","163","Protected Payload (KP0)"
"51","0.378513589","172.27.26.33","172.217.18.138","QUIC","72","Protected Payload (KP0)"
"52","0.378513635","172.27.26.33","10.4.10.40","DNS","71","Standard query 0xe242 A i.ytimg.com"
"53","0.378513681","172.27.26.33","172.217.18.138","TCP","66","42312  >  443 [ACK] Seq=622 Ack=1401 Win=177 Len=0 TSval=2969281474 TSecr=1341834971"
"54","0.378513726","172.27.26.33","172.217.18.138","TCP","66","42312  >  443 [ACK] Seq=622 Ack=2801 Win=183 Len=0 TSval=2969281475 TSecr=1341834971"
"55","0.378513772","172.27.26.33","172.217.18.138","TCP","66","42312  >  443 [ACK] Seq=622 Ack=4201 Win=188 Len=0 TSval=2969281475 TSecr=1341834971"
"56","0.378513817","172.27.26.33","172.217.18.138","TCP","66","42312  >  443 [ACK] Seq=622 Ack=4682 Win=193 Len=0 TSval=2969281475 TSecr=1341834971"
"57","0.378513871","172.27.26.33","172.217.18.138","TLSv1.2","140","Change Cipher Spec, Application Data"
"58","0.378518756","172.27.26.33","172.217.18.138","QUIC","163","Protected Payload (KP0)"
"59","0.378521986","172.27.26.33","172.217.18.138","QUIC","72","Protected Payload (KP0)"
"60","0.378524928","172.27.26.33","10.4.10.40","DNS","71","Standard query 0xe242 A i.ytimg.com"
"61","0.378527993","172.27.26.33","172.217.18.138","TCP","66","42312  >  443 [ACK] Seq=622 Ack=1401 Win=177 Len=0 TSval=2969281474 TSecr=1341834971"
"62","0.378531315","172.27.26.33","172.217.18.138","TCP","66","42312  >  443 [ACK] Seq=622 Ack=2801 Win=183 Len=0 TSval=2969281475 TSecr=1341834971"
"63","0.378534258","172.27.26.33","172.217.18.138","TCP","66","42312  >  443 [ACK] Seq=622 Ack=4201 Win=188 Len=0 TSval=2969281475 TSecr=1341834971"
"64","0.378536967","172.27.26.33","172.217.18.138","TCP","66","42312  >  443 [ACK] Seq=622 Ack=4682 Win=193 Len=0 TSval=2969281475 TSecr=1341834971"
"65","0.378539959","172.27.26.33","172.217.18.138","TCP","140","[TCP Retransmission] 42312  >  443 [PSH, ACK] Seq=622 Ack=4682 Win=193 Len=74 TSval=2969281476 TSecr=1341834971"
"66","0.422425858","HonHaiPrecis_e8:4c:71","Broadcast","ARP","60","Who has 172.27.217.19? Tell 172.27.23.165"
"67","0.429074180","2a:fd:47:91:0c:0e","Broadcast","ARP","60","Who has 172.27.24.71? Tell 172.27.24.88"
"68","0.456995460","172.27.24.242","172.27.255.255","NBNS","92","Name query NB WPAD<00>"
"69","0.469315361","172.27.26.33","142.250.201.138","TCP","66","38522  >  443 [ACK] Seq=576 Ack=1401 Win=90624 Len=0 TSval=4043356574 TSecr=3688141517"
"70","0.469315028","1e:a5:99:fd:c5:07","Broadcast","XID","60","Basic Format; Type 1 and Type 2 LLCs (Class II LLC); Window Size 26"
"71","0.469332416","172.27.26.33","142.250.201.138","TCP","66","[TCP Dup ACK 69#1] 38522  >  443 [ACK] Seq=576 Ack=1401 Win=90624 Len=0 TSval=4043356574 TSecr=3688141517"
"72","0.469573150","172.27.26.33","142.250.201.138","TCP","66","38522  >  443 [ACK] Seq=576 Ack=2801 Win=93696 Len=0 TSval=4043356578 TSecr=3688141517"
"73","0.469573251","172.27.26.33","172.217.18.138","TCP","78","[TCP Dup ACK 64#1] 42312  >  443 [ACK] Seq=696 Ack=4682 Win=193 Len=0 TSval=2969281664 TSecr=1341835222 SLE=4201 SRE=4682"
"74","0.469573296","172.27.26.33","142.250.201.138","TCP","66","38522  >  443 [ACK] Seq=576 Ack=4201 Win=96256 Len=0 TSval=4043356597 TSecr=3688141517"
"75","0.469573341","172.27.26.33","142.250.201.138","TCP","66","38522  >  443 [ACK] Seq=576 Ack=4667 Win=98816 Len=0 TSval=4043356597 TSecr=3688141517"
"76","0.469573387","172.27.26.33","172.217.18.138","QUIC","75","Protected Payload (KP0)"
"77","0.469573432","172.27.26.33","172.217.18.138","QUIC","75","Protected Payload (KP0)"
"78","0.469581670","172.27.26.33","142.250.201.138","TCP","66","38522  >  443 [ACK] Seq=576 Ack=2801 Win=93696 Len=0 TSval=4043356578 TSecr=3688141517"
"79","0.469588853","172.27.26.33","172.217.18.138","TCP","78","[TCP Dup ACK 64#2] 42312  >  443 [ACK] Seq=696 Ack=4682 Win=193 Len=0 TSval=2969281664 TSecr=1341835222 SLE=4201 SRE=4682"
"80","0.469592257","172.27.26.33","142.250.201.138","TCP","66","38522  >  443 [ACK] Seq=576 Ack=4201 Win=96256 Len=0 TSval=4043356597 TSecr=3688141517"
"81","0.469595454","172.27.26.33","142.250.201.138","TCP","66","38522  >  443 [ACK] Seq=576 Ack=4667 Win=98816 Len=0 TSval=4043356597 TSecr=3688141517"
"82","0.469598722","172.27.26.33","172.217.18.138","QUIC","75","Protected Payload (KP0)"
"83","0.469602533","172.27.26.33","172.217.18.138","QUIC","75","Protected Payload (KP0)"
"84","0.477119558","fe80::e482:c5e9:dadb:aa00","ff02::1:3","LLMNR","84","Standard query 0xb1df AAAA wpad"
"85","0.477119694","fe80::e482:c5e9:dadb:aa00","ff02::1:3","LLMNR","84","Standard query 0x97eb A wpad"
"86","0.479969144","172.27.26.33","192.178.24.246","QUIC","1292","Initial, DCID=91e27b95e9bc79f2, PKN: 1, PADDING, PING, CRYPTO, PADDING, CRYPTO, PING"
"87","0.479969245","172.27.26.33","172.217.18.138","TCP","66","42312  >  443 [ACK] Seq=696 Ack=5684 Win=199 Len=0 TSval=2969281695 TSecr=1341835234"
"88","0.479969290","172.27.26.33","192.178.24.246","TCP","74","40298  >  443 [SYN] Seq=0 Win=65535 Len=0 MSS=1460 SACK_PERM TSval=2448119706 TSecr=0 WS=512"
"89","0.479969336","172.27.26.33","172.217.18.138","QUIC","75","Protected Payload (KP0)"
"90","0.479979642","172.27.26.33","192.178.24.246","QUIC","1292","Initial, DCID=91e27b95e9bc79f2, PKN: 1, PADDING, PING, CRYPTO, PADDING, CRYPTO, PING"
"91","0.479991569","172.27.26.33","172.217.18.138","TCP","66","[TCP Dup ACK 87#1] 42312  >  443 [ACK] Seq=696 Ack=5684 Win=199 Len=0 TSval=2969281695 TSecr=1341835234"
"92","0.479995257","172.27.26.33","192.178.24.246","TCP","74","[TCP Retransmission] 40298  >  443 [SYN] Seq=0 Win=65535 Len=0 MSS=1460 SACK_PERM TSval=2448119706 TSecr=0 WS=512"
"93","0.479998832","172.27.26.33","172.217.18.138","QUIC","75","Protected Payload (KP0)"
"94","0.512921011","172.27.26.33","142.250.201.138","TLSv1.2","140","Change Cipher Spec, Application Data"
"95","0.512921530","172.27.26.33","142.250.201.138","TLSv1.2","158","Application Data"
"96","0.512922353","172.27.26.33","142.250.201.138","TLSv1.2","247","Application Data"
"97","0.512973355","172.27.26.33","142.250.201.138","TCP","140","[TCP Retransmission] 38522  >  443 [PSH, ACK] Seq=576 Ack=4667 Win=98816 Len=74 TSval=4043356686 TSecr=3688141517"
"98","0.513025511","172.27.26.33","142.250.201.138","TCP","158","[TCP Retransmission] 38522  >  443 [PSH, ACK] Seq=650 Ack=4667 Win=98816 Len=92 TSval=4043356687 TSecr=3688141517"
"99","0.513036616","172.27.26.33","142.250.201.138","TCP","247","[TCP Retransmission] 38522  >  443 [PSH, ACK] Seq=742 Ack=4667 Win=98816 Len=181 TSval=4043356688 TSecr=3688141517"
"100","0.554626866","172.27.26.33","192.178.24.246","TCP","66","40298  >  443 [ACK] Seq=1 Ack=1 Win=88064 Len=0 TSval=2448119814 TSecr=3066235936"
"101","0.554627132","172.27.26.33","142.250.201.138","TCP","66","38524  >  443 [ACK] Seq=608 Ack=1401 Win=90624 Len=0 TSval=4043356730 TSecr=3987128419"
"102","0.554642725","172.27.26.33","192.178.24.246","TCP","66","[TCP Dup ACK 100#1] 40298  >  443 [ACK] Seq=1 Ack=1 Win=88064 Len=0 TSval=2448119814 TSecr=3066235936"
"103","0.554673587","172.27.26.33","142.250.201.138","TCP","66","[TCP Dup ACK 101#1] 38524  >  443 [ACK] Seq=608 Ack=1401 Win=90624 Len=0 TSval=4043356730 TSecr=3987128419"
"104","0.570985081","1e:a5:99:fd:c5:07","Broadcast","ARP","64","Gratuitous ARP for 172.27.30.182 (Request)"
"105","0.586049565","172.27.26.33","192.178.24.246","TLSv1.2","629","Client Hello (SNI=i.ytimg.com)"
"106","0.586049838","172.27.26.33","142.250.201.138","TCP","66","38524  >  443 [ACK] Seq=608 Ack=2801 Win=93696 Len=0 TSval=4043356731 TSecr=3987128419"
"107","0.586070732","172.27.26.33","192.178.24.246","TCP","629","[TCP Retransmission] 40298  >  443 [PSH, ACK] Seq=1 Ack=1 Win=88064 Len=563 TSval=2448119816 TSecr=3066235936"
"108","0.586090427","172.27.26.33","142.250.201.138","TCP","66","[TCP Dup ACK 106#1] 38524  >  443 [ACK] Seq=608 Ack=2801 Win=93696 Len=0 TSval=4043356731 TSecr=3987128419"
"109","0.591256674","172.27.25.143","17.188.185.132","TLSv1.2","96","Application Data"
"110","0.591275830","172.27.5.225","172.27.25.143","ICMP","124","Redirect             (Redirect for host)"
"111","0.591286888","172.27.25.143","17.188.185.132","TCP","96","[TCP Retransmission] 57354  >  443 [PSH, ACK] Seq=1 Ack=1 Win=2048 Len=30 TSval=2651678594 TSecr=4133598083"
"112","0.593537594","vivoMobileCo_8e:76:a6","Broadcast","ARP","60","Who has 172.27.0.2? Tell 172.27.29.109"
"113","0.615464493","172.27.26.33","142.250.201.138","TLSv1.2","3122","Application Data"
"114","0.615464736","172.27.26.33","142.250.201.138","TLSv1.2","3018","Application Data"
"115","0.615464782","172.27.26.33","142.250.201.138","TCP","66","38522  >  443 [ACK] Seq=6931 Ack=5641 Win=101888 Len=0 TSval=4043356787 TSecr=3688141756"
"116","0.615464826","172.27.26.33","142.250.201.138","TCP","66","38522  >  443 [ACK] Seq=6931 Ack=5806 Win=104448 Len=0 TSval=4043356787 TSecr=3688141757"
"117","0.615482839","172.27.26.33","142.250.201.138","TCP","1090","[TCP Retransmission] 38522  >  443 [ACK] Seq=923 Ack=4667 Win=98816 Len=1024 TSval=4043356753 TSecr=3688141517"
"118","0.615498977","172.27.26.33","142.250.201.138","TCP","1090","[TCP Retransmission] 38522  >  443 [ACK] Seq=1947 Ack=4667 Win=98816 Len=1024 TSval=4043356753 TSecr=3688141517"
"119","0.615502749","172.27.26.33","142.250.201.138","TCP","1074","[TCP Retransmission] 38522  >  443 [PSH, ACK] Seq=2971 Ack=4667 Win=98816 Len=1008 TSval=4043356753 TSecr=3688141517"
"120","0.615508333","172.27.26.33","142.250.201.138","TCP","1090","[TCP Retransmission] 38522  >  443 [ACK] Seq=3979 Ack=4667 Win=98816 Len=1024 TSval=4043356754 TSecr=3688141517"
"121","0.615510908","172.27.26.33","142.250.201.138","TCP","1090","[TCP Retransmission] 38522  >  443 [ACK] Seq=5003 Ack=4667 Win=98816 Len=1024 TSval=4043356754 TSecr=3688141517"
"122","0.615513828","172.27.26.33","142.250.201.138","TCP","970","[TCP Retransmission] 38522  >  443 [PSH, ACK] Seq=6027 Ack=4667 Win=98816 Len=904 TSval=4043356754 TSecr=3688141517"
"123","0.615517165","172.27.26.33","142.250.201.138","TCP","66","38522  >  443 [ACK] Seq=6931 Ack=5641 Win=101888 Len=0 TSval=4043356787 TSecr=3688141756"
"124","0.615519898","172.27.26.33","142.250.201.138","TCP","66","38522  >  443 [ACK] Seq=6931 Ack=5806 Win=104448 Len=0 TSval=4043356787 TSecr=3688141757"
"125","0.615526054","172.27.26.33","142.250.201.138","TCP","66","38524  >  443 [ACK] Seq=608 Ack=4201 Win=96256 Len=0 TSval=4043356787 TSecr=3987128419"
"126","0.615526105","172.27.26.33","142.250.201.138","TCP","66","38524  >  443 [ACK] Seq=608 Ack=4667 Win=98816 Len=0 TSval=4043356787 TSecr=3987128419"
"127","0.615528604","172.27.26.33","142.250.201.138","TCP","66","38524  >  443 [ACK] Seq=608 Ack=4201 Win=96256 Len=0 TSval=4043356787 TSecr=3987128419"
"128","0.615532236","172.27.26.33","142.250.201.138","TCP","66","38524  >  443 [ACK] Seq=608 Ack=4667 Win=98816 Len=0 TSval=4043356787 TSecr=3987128419"
"129","0.624580190","ba:93:54:42:bf:98","Broadcast","ARP","60","Gratuitous ARP for 172.27.29.249 (Reply)"
"130","0.626269876","172.27.26.33","142.250.201.138","TLSv1.2","97","Application Data"
"131","0.626269953","172.27.26.33","142.250.201.138","TLSv1.2","105","Application Data"
"132","0.626271496","172.27.26.33","142.250.201.138","TLSv1.2","140","Change Cipher Spec, Application Data"
"133","0.626279765","172.27.26.33","142.250.201.138","TCP","97","[TCP Retransmission] 38522  >  443 [PSH, ACK] Seq=6931 Ack=5806 Win=104448 Len=31 TSval=4043356789 TSecr=3688141757"
"134","0.626290295","172.27.26.33","142.250.201.138","TCP","105","[TCP Retransmission] 38522  >  443 [PSH, ACK] Seq=6962 Ack=5806 Win=104448 Len=39 TSval=4043356790 TSecr=3688141757"
"135","0.626293573","172.27.26.33","142.250.201.138","TCP","140","[TCP Retransmission] 38524  >  443 [PSH, ACK] Seq=608 Ack=4667 Win=98816 Len=74 TSval=4043356791 TSecr=3987128419"
"136","0.628800188","86:57:ce:47:bb:5e","Broadcast","ARP","60","Who has 172.27.217.19? Tell 172.27.151.50"
"137","0.670892774","172.27.26.33","192.178.24.234","QUIC","1292","Initial, DCID=5d0f0c24ddc8ba1c, PKN: 5, PING, PING, PING, PADDING, CRYPTO, CRYPTO, CRYPTO, PING, CRYPTO, CRYPTO, PADDING"
"138","0.670906455","172.27.26.33","192.178.24.234","QUIC","1292","Initial, DCID=5d0f0c24ddc8ba1c, PKN: 5, PING, PING, PING, PADDING, CRYPTO, CRYPTO, CRYPTO, PING, CRYPTO, CRYPTO, PADDING"
"139","0.725122141","vivoMobileCo_64:ca:86","Broadcast","ARP","60","Who has 172.27.0.2? Tell 172.27.28.110"
"140","0.725122354","172.27.26.33","172.217.18.138","QUIC","71","Protected Payload (KP0)"
"141","0.725145273","172.27.26.33","172.217.18.138","QUIC","71","Protected Payload (KP0)"
"142","0.734853882","HonHaiPrecis_e8:4c:71","Broadcast","ARP","60","Who has 172.27.151.245? Tell 172.27.23.165"
"143","0.741410294","82:f2:fa:be:3b:86","Broadcast","XID","60","Basic Format; Type 1 and Type 2 LLCs (Class II LLC); Window Size 12"
"144","0.743978909","172.27.26.33","192.178.24.246","TCP","66","40298  >  443 [ACK] Seq=564 Ack=1401 Win=90624 Len=0 TSval=2448120009 TSecr=3066236152"
"145","0.743979012","172.27.26.33","192.178.24.246","TCP","66","40298  >  443 [ACK] Seq=564 Ack=2801 Win=93696 Len=0 TSval=2448120009 TSecr=3066236152"
"146","0.743979059","172.27.26.33","192.178.24.246","TCP","66","40298  >  443 [ACK] Seq=564 Ack=4201 Win=96256 Len=0 TSval=2448120009 TSecr=3066236152"
"147","0.743999509","172.27.26.33","192.178.24.246","TCP","66","40298  >  443 [ACK] Seq=564 Ack=1401 Win=90624 Len=0 TSval=2448120009 TSecr=3066236152"
"148","0.744012932","172.27.26.33","192.178.24.246","TCP","66","40298  >  443 [ACK] Seq=564 Ack=2801 Win=93696 Len=0 TSval=2448120009 TSecr=3066236152"
"149","0.744016075","172.27.26.33","192.178.24.246","TCP","66","40298  >  443 [ACK] Seq=564 Ack=4201 Win=96256 Len=0 TSval=2448120009 TSecr=3066236152"
"150","0.766411636","172.27.26.33","192.178.24.246","TCP","66","40298  >  443 [ACK] Seq=564 Ack=4723 Win=98816 Len=0 TSval=2448120010 TSecr=3066236152"
"151","0.766411804","172.27.26.33","192.178.24.246","QUIC","1292","Initial, DCID=91e27b95e9bc79f2, PKN: 3, CRYPTO, CRYPTO, PADDING, CRYPTO, CRYPTO, PADDING, CRYPTO, PADDING, CRYPTO, PING, PADDING, PING, PADDING, CRYPTO, PING, PADDING, CRYPTO, CRYPTO, CRYPTO, PING, CRYPTO"
"152","0.766424151","172.27.26.33","192.178.24.246","TCP","66","[TCP Dup ACK 150#1] 40298  >  443 [ACK] Seq=564 Ack=4723 Win=98816 Len=0 TSval=2448120010 TSecr=3066236152"
"153","0.766454152","172.27.26.33","192.178.24.246","QUIC","1292","Initial, DCID=91e27b95e9bc79f2, PKN: 3, CRYPTO, CRYPTO, PADDING, CRYPTO, CRYPTO, PADDING, CRYPTO, PADDING, CRYPTO, PING, PADDING, PING, PADDING, CRYPTO, PING, PADDING, CRYPTO, CRYPTO, CRYPTO, PING, CRYPTO"
"154","0.773309381","Intel_b2:ad:72","Broadcast","ARP","60","Who has 172.27.217.19? Tell 172.27.30.2"
"155","0.810843696","172.27.25.143","17.253.85.51","QUIC","1392","Initial, DCID=61d2179a975ce31f, SCID=7a0bbc351f0a2fdb, PKN: 0, CRYPTO, PADDING"
"156","0.810843857","172.27.25.143","17.188.185.132","TCP","66","57354  >  443 [ACK] Seq=31 Ack=27 Win=2047 Len=0 TSval=2651678806 TSecr=4133600851"
"157","0.810843905","172.27.25.143","17.253.85.51","QUIC","712","0-RTT, DCID=61d2179a975ce31f, SCID=7a0bbc351f0a2fdb"
"158","0.810868869","172.27.5.225","172.27.25.143","ICMP","590","Redirect             (Redirect for host)"
"159","0.810886444","172.27.25.143","17.253.85.51","QUIC","1392","Initial, DCID=61d2179a975ce31f, SCID=7a0bbc351f0a2fdb, PKN: 0, CRYPTO, PADDING"
"160","0.810891390","172.27.25.143","17.188.185.132","TCP","66","[TCP Dup ACK 156#1] 57354  >  443 [ACK] Seq=31 Ack=27 Win=2047 Len=0 TSval=2651678806 TSecr=4133600851"
"161","0.810895178","172.27.25.143","17.253.85.51","QUIC","712","0-RTT, DCID=61d2179a975ce31f, SCID=7a0bbc351f0a2fdb"
"162","0.831685343","82:f2:fa:be:3b:86","Broadcast","ARP","64","Gratuitous ARP for 172.27.29.199 (Request)"
"163","0.838754262","vivoMobileCo_6f:3b:76","Broadcast","ARP","42","Who has 172.27.0.2? Tell 172.27.27.225"
"164","0.840430278","172.27.5.225","140.82.114.21","TLSv1.2","105","Application Data"
"165","0.856026212","ba:93:54:42:bf:98","Broadcast","ARP","60","Who has 172.27.0.2? Tell 172.27.29.249"
"166","0.856027826","172.27.26.33","142.250.201.138","TCP","66","38524  >  443 [ACK] Seq=682 Ack=5641 Win=101888 Len=0 TSval=4043356934 TSecr=3987128558"
"167","0.856027916","172.27.26.33","192.178.24.246","TLSv1.2","140","Change Cipher Spec, Application Data"
"168","0.856027973","172.27.26.33","192.178.24.246","TLSv1.2","158","Application Data"
"169","0.856028024","172.27.26.33","192.178.24.246","TLSv1.2","239","Application Data"
"170","0.856102784","172.27.26.33","142.250.201.138","TCP","66","[TCP Dup ACK 166#1] 38524  >  443 [ACK] Seq=682 Ack=5641 Win=101888 Len=0 TSval=4043356934 TSecr=3987128558"
"171","0.856128988","172.27.26.33","192.178.24.246","TCP","140","[TCP Retransmission] 40298  >  443 [PSH, ACK] Seq=564 Ack=4723 Win=98816 Len=74 TSval=2448120036 TSecr=3066236152"
"172","0.856135033","172.27.26.33","192.178.24.246","TCP","158","[TCP Retransmission] 40298  >  443 [PSH, ACK] Seq=638 Ack=4723 Win=98816 Len=92 TSval=2448120038 TSecr=3066236152"
"173","0.856139421","172.27.26.33","192.178.24.246","TCP","239","[TCP Retransmission] 40298  >  443 [PSH, ACK] Seq=730 Ack=4723 Win=98816 Len=173 TSval=2448120039 TSecr=3066236152"
"174","0.950519530","2e:fd:cd:77:0c:0e","Broadcast","ARP","60","Who has 172.27.0.2? Tell 172.27.28.34"
"175","0.957056154","ea:e0:bf:e0:d7:d8","Broadcast","ARP","60","Who has 172.27.0.2? Tell 172.27.30.121"
"176","0.959811161","172.27.26.33","142.250.201.138","TCP","66","38522  >  443 [ACK] Seq=7001 Ack=7409 Win=110080 Len=0 TSval=4043357136 TSecr=3688142015"
"177","0.959811244","172.27.26.33","142.250.201.138","TCP","66","38522  >  443 [ACK] Seq=7001 Ack=10209 Win=115712 Len=0 TSval=4043357136 TSecr=3688142015"
"178","0.959811288","172.27.26.33","142.250.201.138","TCP","66","38522  >  443 [ACK] Seq=7001 Ack=13009 Win=121344 Len=0 TSval=4043357136 TSecr=3688142015"
"179","0.959811334","172.27.26.33","142.250.201.138","TCP","66","38522  >  443 [ACK] Seq=7001 Ack=15809 Win=126976 Len=0 TSval=4043357136 TSecr=3688142023"
"180","0.959811379","172.27.26.33","142.250.201.138","TCP","66","38522  >  443 [ACK] Seq=7001 Ack=18609 Win=132608 Len=0 TSval=4043357137 TSecr=3688142032"
"181","0.959821889","172.27.26.33","142.250.201.138","TCP","66","38522  >  443 [ACK] Seq=7001 Ack=7409 Win=110080 Len=0 TSval=4043357136 TSecr=3688142015"
"182","0.959853888","172.27.26.33","142.250.201.138","TCP","66","38522  >  443 [ACK] Seq=7001 Ack=10209 Win=115712 Len=0 TSval=4043357136 TSecr=3688142015"
"183","0.959857135","172.27.26.33","142.250.201.138","TCP","66","38522  >  443 [ACK] Seq=7001 Ack=13009 Win=121344 Len=0 TSval=4043357136 TSecr=3688142015"
"184","0.959860236","172.27.26.33","142.250.201.138","TCP","66","38522  >  443 [ACK] Seq=7001 Ack=15809 Win=126976 Len=0 TSval=4043357136 TSecr=3688142023"
"185","0.959863073","172.27.26.33","142.250.201.138","TCP","66","38522  >  443 [ACK] Seq=7001 Ack=18609 Win=132608 Len=0 TSval=4043357137 TSecr=3688142032"
"186","1.001994001","HonHaiPrecis_e8:be:0b","Broadcast","ARP","60","Who has 172.27.151.245? Tell 172.27.234.220"
"187","1.023936241","172.27.26.33","142.250.201.138","TCP","66","38522  >  443 [ACK] Seq=7001 Ack=21409 Win=138240 Len=0 TSval=4043357137 TSecr=3688142040"
"188","1.023952553","172.27.26.33","142.250.201.138","TCP","66","[TCP Dup ACK 187#1] 38522  >  443 [ACK] Seq=7001 Ack=21409 Win=138240 Len=0 TSval=4043357137 TSecr=3688142040"
"189","1.045928736","172.27.26.33","142.250.201.138","TCP","66","38522  >  443 [ACK] Seq=7001 Ack=23508 Win=143872 Len=0 TSval=4043357137 TSecr=3688142049"
"190","1.045928961","172.27.26.33","192.178.24.246","TCP","66","40298  >  443 [ACK] Seq=903 Ack=5838 Win=104448 Len=0 TSval=2448120236 TSecr=3066236312"
"191","1.045960566","172.27.26.33","142.250.201.138","TCP","66","[TCP Dup ACK 189#1] 38522  >  443 [ACK] Seq=7001 Ack=23508 Win=143872 Len=0 TSval=4043357137 TSecr=3688142049"
"192","1.045978261","172.27.26.33","192.178.24.246","TCP","66","[TCP Dup ACK 190#1] 40298  >  443 [ACK] Seq=903 Ack=5838 Win=104448 Len=0 TSval=2448120236 TSecr=3066236312"
"193","1.054048068","172.27.26.33","142.250.201.138","TLSv1.2","105","Application Data"
"194","1.054049664","172.27.26.33","192.178.24.246","TLSv1.2","97","Application Data"
"195","1.054049729","172.27.26.33","192.178.24.246","TLSv1.2","105","Application Data"
"196","1.054049775","172.27.26.33","172.217.18.138","QUIC","79","Protected Payload (KP0)"
"197","1.054064703","172.27.26.33","142.250.201.138","TCP","105","[TCP Retransmission] 38522  >  443 [PSH, ACK] Seq=7001 Ack=23508 Win=143872 Len=39 TSval=4043357151 TSecr=3688142049"
"198","1.054080281","172.27.26.33","192.178.24.246","TCP","97","[TCP Retransmission] 40298  >  443 [PSH, ACK] Seq=903 Ack=5838 Win=104448 Len=31 TSval=2448120239 TSecr=3066236312"
"199","1.054083994","172.27.26.33","192.178.24.246","TCP","105","[TCP Retransmission] 40298  >  443 [PSH, ACK] Seq=934 Ack=5838 Win=104448 Len=39 TSval=2448120239 TSecr=3066236312"
"200","1.054086828","172.27.26.33","172.217.18.138","QUIC","79","Protected Payload (KP0)"
"201","1.057972222","172.27.26.33","192.178.24.246","TCP","78","[TCP Dup ACK 190#2] 40298  >  443 [ACK] Seq=973 Ack=5838 Win=104448 Len=0 TSval=2448120323 TSecr=3066236453 SLE=5673 SRE=5838"
"202","1.057980491","172.27.26.33","192.178.24.246","TCP","78","[TCP Dup ACK 190#3] 40298  >  443 [ACK] Seq=973 Ack=5838 Win=104448 Len=0 TSval=2448120323 TSecr=3066236453 SLE=5673 SRE=5838"
"203","1.067012671","140.82.114.21","172.27.5.225","TLSv1.2","105","Application Data"
"204","1.067045211","172.27.5.225","140.82.114.21","TCP","66","39552  >  443 [ACK] Seq=40 Ack=40 Win=635 Len=0 TSval=1464945807 TSecr=3421652484"
"205","1.163857968","LiteonTechno_9c:e3:0d","Broadcast","ARP","60","Who has 172.27.6.197? Tell 172.27.155.38"
"206","1.165015093","fa:a4:1c:fb:a6:b3","Broadcast","ARP","60","Who has 172.27.0.2? Tell 172.27.28.47"
"207","1.169026925","172.27.25.143","17.253.85.51","QUIC","159","Handshake, DCID=04bdd608326285e9d3abed9e8b8416559b6cee95, SCID=7a0bbc351f0a2fdb"
"208","1.169052207","172.27.5.225","172.27.25.143","ICMP","187","Redirect             (Redirect for host)"
"209","1.169068600","172.27.25.143","17.253.85.51","QUIC","159","Handshake, DCID=04bdd608326285e9d3abed9e8b8416559b6cee95, SCID=7a0bbc351f0a2fdb"
"210","1.175646528","172.27.25.143","17.253.85.51","QUIC","1392","Initial, DCID=04bdd608326285e9d3abed9e8b8416559b6cee95, SCID=7a0bbc351f0a2fdb"
"211","1.175646635","172.27.25.143","17.253.85.51","QUIC","88","Protected Payload (KP0)"
"212","1.175646680","172.27.25.143","17.253.85.51","QUIC","276","Protected Payload (KP0)"
"213","1.175656172","172.27.25.143","17.253.85.51","QUIC","1392","Initial, DCID=04bdd608326285e9d3abed9e8b8416559b6cee95, SCID=7a0bbc351f0a2fdb"
"214","1.175667024","172.27.25.143","17.253.85.51","QUIC","88","Protected Payload (KP0)"
"215","1.175670197","172.27.25.143","17.253.85.51","QUIC","276","Protected Payload (KP0)"
"216","1.189328525","172.27.25.143","17.253.85.51","QUIC","88","Protected Payload (KP0)"
"217","1.189343246","172.27.25.143","17.253.85.51","QUIC","88","Protected Payload (KP0)"
"218","1.210736821","Intel_57:a2:3d","Broadcast","ARP","42","ARP Announcement for 172.27.29.2"
"219","1.214080755","172.27.24.242","172.27.255.255","NBNS","92","Name query NB WPAD<00>"
"220","1.314557560","172.27.5.225","35.190.72.216","TCP","74","40420  >  443 [SYN] Seq=0 Win=64240 Len=0 MSS=1460 SACK_PERM TSval=908247401 TSecr=0 WS=128"
"221","1.349528410","35.190.72.216","172.27.5.225","TCP","74","443  >  40420 [SYN, ACK] Seq=0 Ack=1 Win=65535 Len=0 MSS=1412 SACK_PERM TSval=1092154744 TSecr=908247401 WS=256"
"222","1.349558939","172.27.5.225","35.190.72.216","TCP","66","40420  >  443 [ACK] Seq=1 Ack=1 Win=64256 Len=0 TSval=908247436 TSecr=1092154744"
"223","1.350052772","172.27.5.225","35.190.72.216","TLSv1.3","891","Client Hello (SNI=location.services.mozilla.com)"
"224","1.358962381","2a:fe:c1:be:3d:00","Broadcast","XID","60","Basic Format; Type 1 and Type 2 LLCs (Class II LLC); Window Size 100"
"225","1.391116883","35.190.72.216","172.27.5.225","TCP","66","443  >  40420 [ACK] Seq=1 Ack=826 Win=268032 Len=0 TSval=1092154782 TSecr=908247437"
"226","1.393189466","172.27.26.33","192.178.24.246","QUIC","1292","Initial, DCID=91e27b95e9bc79f2, PKN: 5, PING, CRYPTO, PING, PING, PING, PADDING, PING, PADDING, CRYPTO, PADDING, PING, PING, CRYPTO, PADDING"
"227","1.393202325","172.27.26.33","192.178.24.246","QUIC","1292","Initial, DCID=91e27b95e9bc79f2, PKN: 5, PING, CRYPTO, PING, PING, PING, PADDING, PING, PADDING, CRYPTO, PADDING, PING, PING, CRYPTO, PADDING"
"228","1.400716151","172.27.25.143","17.253.85.51","QUIC","88","Protected Payload (KP0)"
"229","1.400716388","172.27.25.143","17.253.85.51","QUIC","88","Protected Payload (KP0)"
"230","1.400726650","172.27.25.143","17.253.85.51","QUIC","88","Protected Payload (KP0)"
"231","1.400737919","172.27.25.143","17.253.85.51","QUIC","88","Protected Payload (KP0)"
"232","1.410283136","172.27.25.143","17.253.85.51","QUIC","178","Protected Payload (KP0)"
"233","1.410292323","172.27.25.143","17.253.85.51","QUIC","178","Protected Payload (KP0)"
"234","1.414733476","172.27.25.143","17.253.85.51","QUIC","1138","Protected Payload (KP0)"
"235","1.414754437","172.27.25.143","17.253.85.51","QUIC","1138","Protected Payload (KP0)"
"236","1.419085697","HonHaiPrecis_e8:4c:71","Broadcast","ARP","60","Who has 172.27.151.245? Tell 172.27.23.165"
"237","1.436827737","92:c3:20:cb:bc:a5","Broadcast","LLC","60","U, func=XID; DSAP NULL LSAP Individual, SSAP NULL LSAP Command"
"238","1.494235224","172.27.5.225","57.144.148.145","TLSv1.2","95","Application Data"
"239","1.494733449","35.190.72.216","172.27.5.225","TLSv1.3","294","Server Hello, Change Cipher Spec, Application Data"
"240","1.494762180","172.27.5.225","35.190.72.216","TCP","66","40420  >  443 [ACK] Seq=826 Ack=229 Win=64128 Len=0 TSval=908247581 TSecr=1092154889"
"241","1.495168833","172.27.5.225","35.190.72.216","TLSv1.3","72","Change Cipher Spec"
"242","1.495264944","172.27.5.225","35.190.72.216","TLSv1.3","140","Application Data"
"243","1.497607888","172.27.5.225","35.190.72.216","TLSv1.3","112","Application Data"
"244","1.497665537","172.27.5.225","35.190.72.216","TLSv1.3","115","Application Data"
"245","1.497769409","172.27.5.225","35.190.72.216","TLSv1.3","1466","Application Data, Application Data"
"246","1.497778041","172.27.5.225","35.190.72.216","TCP","1466","40420  >  443 [ACK] Seq=2401 Ack=229 Win=64128 Len=1400 TSval=908247584 TSecr=1092154889 [TCP PDU reassembled in 248]"
"247","1.497782008","172.27.5.225","35.190.72.216","TCP","1466","40420  >  443 [ACK] Seq=3801 Ack=229 Win=64128 Len=1400 TSval=908247584 TSecr=1092154889 [TCP PDU reassembled in 248]"
"248","1.497787208","172.27.5.225","35.190.72.216","TLSv1.3","372","Application Data"
"249","1.573987507","172.27.5.225","35.190.72.216","TCP","372","[TCP Retransmission] 40420  >  443 [PSH, ACK] Seq=5201 Ack=229 Win=64128 Len=306 TSval=908247661 TSecr=1092154889 [TCP PDU reassembled in 248]"
"250","1.585048051","57.144.148.145","172.27.5.225","TCP","66","443  >  58888 [ACK] Seq=1 Ack=30 Win=595 Len=0 TSval=3986384311 TSecr=2486250368"
"251","1.585048218","35.190.72.216","172.27.5.225","TCP","66","443  >  40420 [ACK] Seq=229 Ack=832 Win=268032 Len=0 TSval=1092154924 TSecr=908247582"
"252","1.585048263","35.190.72.216","172.27.5.225","TCP","66","443  >  40420 [ACK] Seq=229 Ack=906 Win=268032 Len=0 TSval=1092154924 TSecr=908247582"
"253","1.585048308","35.190.72.216","172.27.5.225","TLSv1.3","684","Application Data, Application Data"
"254","1.585048353","35.190.72.216","172.27.5.225","TCP","66","443  >  40420 [ACK] Seq=847 Ack=1001 Win=268032 Len=0 TSval=1092154927 TSecr=908247584"
"255","1.585048398","35.190.72.216","172.27.5.225","TLSv1.3","97","Application Data"
"256","1.585048443","35.190.72.216","172.27.5.225","TCP","66","443  >  40420 [ACK] Seq=878 Ack=3801 Win=265472 Len=0 TSval=1092154928 TSecr=908247584"
"257","1.585048488","35.190.72.216","172.27.5.225","TCP","66","443  >  40420 [ACK] Seq=878 Ack=5507 Win=263936 Len=0 TSval=1092154929 TSecr=908247584"
"258","1.585164614","172.27.5.225","35.190.72.216","TCP","66","40420  >  443 [ACK] Seq=5507 Ack=878 Win=63488 Len=0 TSval=908247672 TSecr=1092154925"
"259","1.585273107","172.27.5.225","35.190.72.216","TLSv1.3","97","Application Data"
"260","1.607836751","35.190.72.216","172.27.5.225","TCP","97","[TCP Spurious Retransmission] 443  >  40420 [PSH, ACK] Seq=847 Ack=5507 Win=263936 Len=31 TSval=1092155001 TSecr=908247584"
"261","1.607856124","172.27.5.225","35.190.72.216","TCP","78","[TCP Dup ACK 258#1] 40420  >  443 [ACK] Seq=5538 Ack=878 Win=63488 Len=0 TSval=908247694 TSecr=1092155001 SLE=847 SRE=878"
"262","1.616202283","35.190.72.216","172.27.5.225","TCP","78","[TCP Dup ACK 257#1] 443  >  40420 [ACK] Seq=878 Ack=5507 Win=263936 Len=0 TSval=1092155009 TSecr=908247661 SLE=5201 SRE=5507"
"263","1.632346256","35.190.72.216","172.27.5.225","TCP","66","443  >  40420 [ACK] Seq=878 Ack=5538 Win=263936 Len=0 TSval=1092155025 TSecr=908247672"
"264","1.638320933","86:57:ce:47:bb:5e","Broadcast","ARP","60","Who has 172.27.217.19? Tell 172.27.151.50"
"265","1.649130957","57.144.148.145","172.27.5.225","TLSv1.2","91","Application Data"
"266","1.649152193","172.27.5.225","57.144.148.145","TCP","66","58888  >  443 [ACK] Seq=30 Ack=26 Win=501 Len=0 TSval=2486250523 TSecr=3986384431"
"267","1.681527130","172.27.25.143","8.8.8.8","TCP","78","57368  >  443 [SYN, ECE, CWR] Seq=0 Win=65535 Len=0 MSS=1250 WS=64 TSval=535551112 TSecr=0 SACK_PERM"
"268","1.681540410","172.27.25.143","8.8.8.8","TCP","78","[TCP Retransmission] 57368  >  443 [SYN, ECE, CWR] Seq=0 Win=65535 Len=0 MSS=1250 WS=64 TSval=535551112 TSecr=0 SACK_PERM"
"269","1.719348187","172.27.25.143","17.253.85.51","QUIC","89","Protected Payload (KP0)"
"270","1.719349971","172.27.25.143","17.253.85.51","QUIC","89","Protected Payload (KP0)"
"271","1.719350027","172.27.25.143","17.253.85.51","QUIC","89","Protected Payload (KP0)"
"272","1.719384708","172.27.25.143","17.253.85.51","QUIC","89","Protected Payload (KP0)"
"273","1.719402028","172.27.25.143","17.253.85.51","QUIC","89","Protected Payload (KP0)"
"274","1.719405073","172.27.25.143","17.253.85.51","QUIC","89","Protected Payload (KP0)"
"275","1.721520129","172.27.25.143","8.8.8.8","TLSv1.2","583","Client Hello (SNI=dns.google)"
"276","1.721552904","172.27.25.143","8.8.8.8","TCP","583","[TCP Retransmission] 57368  >  443 [PSH, ACK] Seq=1 Ack=1 Win=131200 Len=517 TSval=535551172 TSecr=1040158165"
"277","1.760240614","vivoMobileCo_64:ca:86","Broadcast","ARP","60","Who has 172.27.0.2? Tell 172.27.28.110"
"278","1.785507847","35.190.72.216","172.27.5.225","TLSv1.3","219","Application Data"
"279","1.785529772","172.27.5.225","35.190.72.216","TCP","66","40420  >  443 [ACK] Seq=5538 Ack=1031 Win=63360 Len=0 TSval=908247872 TSecr=1092155171"
"280","1.785767722","172.27.5.225","35.190.72.216","TLSv1.3","105","Application Data"
"281","1.820524989","4a:91:9a:43:4f:1c","Broadcast","ARP","60","Who has 172.27.0.2? Tell 172.27.28.89"
"282","1.827196021","35.190.72.216","172.27.5.225","TCP","66","443  >  40420 [ACK] Seq=1031 Ack=5577 Win=263936 Len=0 TSval=1092155222 TSecr=908247872"
"283","1.846585773","4a:91:9a:43:4f:1c","Broadcast","ARP","60","Who has 172.27.0.2? Tell 172.27.28.89"
"284","1.874226121","172.27.25.143","8.8.8.8","TCP","66","57368  >  443 [ACK] Seq=518 Ack=1239 Win=129984 Len=0 TSval=535551319 TSecr=1040158312"
"285","1.874226283","172.27.25.143","8.8.8.8","TCP","66","57368  >  443 [ACK] Seq=518 Ack=4245 Win=131072 Len=0 TSval=535551324 TSecr=1040158312"
"286","1.874265519","172.27.5.225","172.27.25.143","ICMP","94","Redirect             (Redirect for host)"
"287","1.874282555","172.27.25.143","8.8.8.8","TCP","66","57368  >  443 [ACK] Seq=518 Ack=1239 Win=129984 Len=0 TSval=535551319 TSecr=1040158312"
"288","1.874286893","172.27.25.143","8.8.8.8","TCP","66","57368  >  443 [ACK] Seq=518 Ack=4245 Win=131072 Len=0 TSval=535551324 TSecr=1040158312"
"289","1.879727045","172.27.25.143","8.8.8.8","TLSv1.2","130","Change Cipher Spec, Application Data"
"290","1.879727256","172.27.25.143","8.8.8.8","TLSv1.2","851","Application Data"
"291","1.879752919","172.27.25.143","8.8.8.8","TCP","130","[TCP Retransmission] 57368  >  443 [PSH, ACK] Seq=518 Ack=4245 Win=131072 Len=64 TSval=535551330 TSecr=1040158312"
"292","1.879768159","172.27.25.143","8.8.8.8","TCP","851","[TCP Retransmission] 57368  >  443 [PSH, ACK] Seq=582 Ack=4245 Win=131072 Len=785 TSval=535551333 TSecr=1040158312"
"293","1.884986021","172.27.25.143","17.188.185.132","TCP","2542","57354  >  443 [ACK] Seq=31 Ack=27 Win=2048 Len=2476 TSval=2651679892 TSecr=4133600851 [TCP PDU reassembled in 331]"
"294","1.885014217","172.27.25.143","17.188.185.132","TCP","1304","[TCP Retransmission] 57354  >  443 [ACK] Seq=31 Ack=27 Win=2048 Len=1238 TSval=2651679892 TSecr=4133600851"
"295","1.885028859","172.27.25.143","17.188.185.132","TCP","1304","[TCP Retransmission] 57354  >  443 [ACK] Seq=1269 Ack=27 Win=2048 Len=1238 TSval=2651679892 TSecr=4133600851 [TCP PDU reassembled in 331]"
"296","1.892750094","fa:a4:1c:fb:a6:b3","Broadcast","ARP","60","Who has 172.27.0.2? Tell 172.27.28.47"
"297","1.899043972","4a:91:9a:43:4f:1c","Broadcast","ARP","60","Who has 172.27.0.2? Tell 172.27.28.89"
"298","1.906715259","172.27.26.33","192.178.24.234","QUIC","1292","Initial, DCID=5d0f0c24ddc8ba1c, PKN: 7, PING, PADDING, CRYPTO, PADDING, PING, PADDING, PING, PING, PADDING, PING, PING"
"299","1.906776916","172.27.26.33","192.178.24.234","QUIC","1292","Initial, DCID=5d0f0c24ddc8ba1c, PKN: 7, PING, PADDING, CRYPTO, PADDING, PING, PADDING, PING, PING, PADDING, PING, PING"
"300","1.924585148","172.27.25.143","8.8.8.8","TCP","66","57368  >  443 [ACK] Seq=1367 Ack=4859 Win=130432 Len=0 TSval=535551371 TSecr=1040158366"
"301","1.924585320","172.27.25.143","8.8.8.8","TLSv1.2","97","Application Data"
